{
  "dedi_version": "0.1",
  "type": "dedi-manifest",
  "domain": "example.org",
  "name": "Example Org Trust Services",
  "keys": [
    { "kid": "key-1", "kty": "OKP", "crv": "Ed25519", "x": "11qYAYKxCrfVS_7TyWQHOg7hcvPapiMlrwIaaPcHURo" }
  ],
  "updated_at": "2026-07-01T09:00:00Z",
  "next_update": "2026-07-15T10:00:00Z",
  "files": [
    {
      "registry": "public-keys",
      "url": "https://example.org/dedi/public-keys.dedi.json",
      "digest": "sha-256:9f2c1d4e7a8b0c3d5e6f70819293a4b5c6d7e8f90a1b2c3d4e5f60718293aebae",
      "schema": "https://raw.githubusercontent.com/LF-Decentralized-Trust-labs/decentralized-directory-protocol/main/schemas/public_key.json"
    },
    {
      "registry": "revocations",
      "url": "https://example.org/dedi/revocations.dedi.json",
      "digest": "sha-256:5b1a2c3d4e5f60718293a4b5c6d7e8f90a1b2c3d4e5f60718293a4b5c6d7e8f0",
      "schema": "https://raw.githubusercontent.com/LF-Decentralized-Trust-labs/decentralized-directory-protocol/main/schemas/revoke.json"
    }
  ],
  "proof": {
    "verification_method": "key-1",
    "canonicalization": "JCS",
    "jws": "eyJhbGciOiJFZERTQSIsImI2NCI6ZmFsc2UsImNyaXQiOlsiYjY0Il19..ILLUSTRATIVE_DETACHED_SIGNATURE_NOT_CRYPTOGRAPHICALLY_VALID"
  }
}
